{
  "adapter": "reference-numpy",
  "params": {
    "const": {
      "estimate": -0.041498263953464204,
      "se": 0.05316981829073191,
      "tstat": -0.7804853446470742
    },
    "diff.lag1": {
      "estimate": 0.017950469399074766,
      "se": 0.05820329617582375,
      "tstat": 0.30840984237128066
    },
    "level.lag1": {
      "estimate": -0.0036643306061543562,
      "se": 0.006545687285660353,
      "tstat": -0.5598083816472277
    }
  },
  "scalars": {
    "adf_stat": -0.5598083816472277,
    "df_resid": 295,
    "lags": 1,
    "nobs": 298,
    "rank": 3,
    "sigma2": 0.836082254786522,
    "ss_resid": 246.64426516202397
  },
  "spec_id": "adf-002"
}
