{
  "adapter": "reference-numpy",
  "params": {
    "const": {
      "estimate": -0.5124301387937903,
      "pvalue": 4.040741095332668e-06,
      "se": 0.10939553721189303,
      "tstat": -4.684196008848531
    },
    "d": {
      "estimate": 0.8823077330513953,
      "pvalue": 4.717661410072993e-13,
      "se": 0.11732248879400148,
      "tstat": 7.520363249373093
    },
    "w": {
      "estimate": 0.49779962884108997,
      "pvalue": 1.6705603660057305e-05,
      "se": 0.11401093930662005,
      "tstat": 4.366244431179642
    }
  },
  "scalars": {
    "df_resid": 347,
    "first_stage_F": 189.18539735767735,
    "first_stage_df_den": 347,
    "first_stage_df_num": 1,
    "n_instruments": 3,
    "nobs": 350,
    "overid_df": 0,
    "r2": 0.5675874846973604,
    "rank": 3,
    "sigma2": 4.14962670819386,
    "ss_resid": 1439.9204677432692,
    "ss_total": 3329.96945459705
  },
  "spec_id": "iv-003"
}
