{
  "adapter": "reference-numpy",
  "params": {
    "const": {
      "estimate": 1.7415982554305456,
      "pvalue": 8.148125604104813e-37,
      "se": 0.11472801862188209,
      "tstat": 15.180234753033295
    },
    "x1": {
      "estimate": 2.0163216165244098,
      "pvalue": 2.860227133816777e-79,
      "se": 0.07009074132259366,
      "tstat": 28.76730333389199
    },
    "x2": {
      "estimate": -0.7984134904579748,
      "pvalue": 7.31949017782999e-46,
      "se": 0.04463832849777117,
      "tstat": -17.886276599667937
    }
  },
  "scalars": {
    "adj_r2": 0.8284815195108541,
    "df_model": 2,
    "df_resid": 237,
    "nobs": 240,
    "r2": 0.8299168206028135,
    "rank": 3,
    "sigma2": 1.0189241305483385,
    "ss_resid": 241.4850189399562,
    "ss_total": 1419.8054140088043
  },
  "spec_id": "ols-001"
}
