{
  "adapter": "reference-numpy",
  "params": {
    "x1": {
      "estimate": 0.6033983257740281,
      "pvalue": 1.108121268434811e-35,
      "se": 0.043373652768679154,
      "tstat": 13.911632690750736
    },
    "x2": {
      "estimate": -1.078555757472912,
      "pvalue": 5.096700194347665e-109,
      "se": 0.03358948849290623,
      "tstat": -32.109919080806854
    }
  },
  "scalars": {
    "df_resid": 370,
    "n_entities": 55,
    "nobs": 427,
    "r2_within": 0.7610121968627629,
    "rank": 2,
    "sigma2": 0.7063598913125833,
    "ss_resid": 261.3531597856558,
    "ss_within": 1093.583673956681
  },
  "spec_id": "fe-003"
}
